<?xml version = "1.0" standalone="no"?>
<!DOCTYPE template SYSTEM "../dtd/file_template.dtd">

<template name="Csharp">
    <file_extension>cs</file_extension>
    <comment>
        <open>/*</open>
        <close>*/</close>
        <inline>//</inline>
    </comment>
    <syntax>
      <statement_terminator>;</statement_terminator>
      <import_code>using {{import_file}};</import_code>
    </syntax>
    <variables prefix="">
        <variable type="int" code="int" init="0"/>
        <variable type="string" code="string" init="null"/>
    </variables>
    <code>
/*
{{comments}}
*/

/*
{{license}}
*/
{{stdlib_imports}}
namespace default_namespace{
    class {{main_name}}{
        public static void Main(string[] args){
            {{local_var}}
            {{input_content}}
            {{filtering_content}}
            {{sink_content}}
            {{exec_queries_content}}
        }
        {{static_methods}}
    }
}
        </code>
</template>
