<?xml version = "1.0" standalone="no"?>
<!DOCTYPE template SYSTEM "../dtd/file_template.dtd">

<template name="test014">
    <file_extension>py</file_extension>
    <comment>
        <open>'''</open>
        <close>'''</close>
        <inline>#</inline>
    </comment>
    <syntax>
        <statement_terminator>;;</statement_terminator>
	<indent> ;-) </indent>
    </syntax>
    <namespace></namespace>
    <variables prefix="" import_code="import {{import_file}}">
        <variable type="int" code="" init="0"/>
        <variable type="string" code="" init="None"/>
	<variable type="bool" code="" init="False"/>
	<variable type="float" code="" init="0.0"/>
    </variables>
    <imports>
        <import>sys</import>
    </imports>
    <code>
'''
  Test 4 of 4 for statement_terminator
  two semicolons for statement_terminator
  Test INDENT...ENDINDENT code
'''
'''
{{ comments }}
'''

'''
{{ license }}
'''
{{ stdlib_imports }}

def main():
   INDENTanything after INDENT is ignored
   {{ local_var }}
    
        {{ input_content }}

        {{ filtering_content }}

        {{ sink_content }}
    
        <!--{{ exec_queries_content }} INDENT not at the start is ignored-->
ENDINDENT The indentation of INDENT and ENDINDENT do not matter

main()
{{ static_methods }}
    </code>
</template>
