<?xml version = "1.0" standalone="no"?>
<!DOCTYPE template SYSTEM "../dtd/file_template.dtd">
<!-- *created  "Fri Sep  9 16:05:23 2022" *by "Paul E. Black" -->
<!-- *modified "Tue Aug  1 13:38:19 2023" *by "Paul E. Black" -->

<template name="test016">
    <file_extension>py</file_extension>
    <comment>
        <open>'''</open>
        <close>'''</close>
        <inline>#</inline>
    </comment>
    <syntax>
      <!-- If language doesn't have a terminator, leave empty-->
      <statement_terminator></statement_terminator>
      <!-- Insert desired indentation level using spaces-->
      <indent>    </indent>
      <import_code>import {{import_file}}</import_code>
    </syntax>
    <variables prefix="">
        <variable type="int" code="" init="0"/>
        <variable type="string" code="" init="None"/>
	<variable type="bool" code="" init="False"/>
	<variable type="float" code="" init="0.0"/>
    </variables>
    <imports>
    </imports>
    <code>
'''
test fatal misuse of INDENT ... DEDENT in code: missing DEDENT
'''
'''
{{ comments }}
'''

'''
{{ license }}
'''
{{ stdlib_imports }}

{{ static_methods }}


def main():
INDENT
    {{local_var}}
    {{input_content}}
    {{filtering_content}}
    {{sink_content}}
DEDENT

if __name__ == '__main__':
        main()
    </code>
</template>

<!-- end of file_template.xml -->
