<?xml version = "1.0" standalone="no"?>
<!DOCTYPE template SYSTEM "../dtd/file_template.dtd">
<template name="PHP">
    <file_extension>php</file_extension>
    <comment>
        <open>/*</open>
        <close>*/</close>
        <inline>//</inline>
    </comment>
    <syntax>
      <statement_terminator>;</statement_terminator>
      <import_code>include "{{import_file}}";</import_code>
    </syntax>
    <variables prefix="$">
        <variable type="int" code="" init="0"/>
        <variable type="string" code="" init="null"/>
    </variables>
    <imports>
    </imports>
    <code>
        &lt;?php
        /*
        {{comments}}
        */

        /*
        {{license}}
        */
        {{stdlib_imports}}

        {{local_var}}
        {{input_content}}
        {{filtering_content}}
        {{sink_content}}
        {{exec_queries_content}}

        {{static_methods}}

        ?>
        </code>
</template>
